imdb_title_id,title,original_title,year,date_published,genre,duration,country,language,director,writer,production_company,actors,description,avg_vote,votes,budget,usa_gross_income,worlwide_gross_income,metascore,reviews_from_users,reviews_from_critics
tt9580138,Mortal Kombat Legends: Scorpion's Revenge,Mortal Kombat Legends: Scorpion's Revenge,2020,2020-04-12,"Animation, Action, Adventure",80,USA,English,Ethan Spaulding,"Jeremy Adams, Ed Boon",DC Entertainment,"Jennifer Carpenter, Joel McHale, Ike Amadi, Steve Blum, Artt Butler, Darin De Paul, Robin Atkin Downes, Grey Griffin, Dave B. Mitchell, Kevin Michael Richardson, Jordan Rodrigues, Patrick Seitz, Fred Tatasciore","Hanzo Hasashi loses his clan, family, and his life during an attack by a rival ninja clan. He is given the chance to compete in an interdimensional tournament to save his loved ones.",7.5,9100,,,,,192.0,40.0
tt9581076,Di Jiu Tian Chang,Di Jiu Tian Chang,2019,2019-03-22,Drama,185,China,Chinese,Xiaoshuai Wang,"Mei Ah, Xiaoshuai Wang",Dongchun Films,"Jingchun Wang, Mei Yong, Xi Qi, Roy Wang, Jiang Du, Liya Ai, Cheng Xu, Jingjing Li, Zhao-Yan Guo-Zhang, Zhenjiang Bao, Shuang Wu, Zizi Wang, Xinyuan Zhang, Jiachen Wu, Yajun Wang",Two married couples adjust to the vast social and economic changes taking place in China from the 1980s to the present.,7.7,2595,,,$ 8096596,88.0,18.0,54.0
tt9581172,Öndög,Öndög,2019,2019-10-03,Drama,100,"Mongolia, China",,Quan'an Wang,Quan'an Wang,,"Aorigeletu, Gangtemuer Arild, Dulamjav Enkhtaivan, Norovsambuu","A murder case in the Mongolian steppe. A herder is asked to guard the crime scene - a woman who resolutely scares off both wolves and her neighbor. She has her own plans for the future, ...",6.6,456,,,,,1.0,31.0
tt9584814,Gloria Mundi,Gloria Mundi,2019,2020-03-19,Drama,106,"France, Italy",French,Robert Guédiguian,"Robert Guédiguian, Serge Valletti",AGAT Films & Cie / Ex Nihilo,"Ariane Ascaride, Jean-Pierre Darroussin, Gérard Meylan, Anaïs Demoustier, Robinson Stévenin, Lola Naymark, Grégoire Leprince-Ringuet, Angelica Sarre, Pauline Caupenne, Yann Trégouët, Mathilde Ulmer, Diouc Koma, Adrien Jolivet, Karine Angeon, Ferdinand Verhaeghe","In Marseille, a family gathers for the birth of baby Gloria. But despite the joy, the young parents have fallen on tough times. As they try to make ends meet, they reconnect with Gloria's ex-convict grandfather.",5.9,393,,,$ 2358012,,1.0,23.0
tt9586294,Shao nian de ni,Shao nian de ni,2019,2019-10-25,"Crime, Drama, Family",135,China,"Mandarin, English",Derek Tsang,"Wing-Sum Lam, Yuan Li",Shooting Pictures,"Dongyu Zhou, Jackson Yee, Fang Yin, Jue Huang, Lüyun Heliao, Ran Liu, Junlin Luo, Yue Wu, Yujuan Wu, Xinyi Zhang, Yao Zhang, Yifan Zhang, Runnan Zhao, Ye Zhou","A bullied teenage girl forms an unlikely friendship with a mysterious young man who protects her from her assailants, all while she copes with the pressures of her final examinations.",7.6,2328,,$ 1921657,$ 225820914,83.0,37.0,24.0
tt9587244,Take Home Pay,Take Home Pay,2019,2019-08-25,"Action, Comedy",105,New Zealand,English,Stallone Vaiaoga-Ioasa,Stallone Vaiaoga-Ioasa,Cadness Street,"Tofiga Fepulea'i, Vito Vito, Ronnie Taulafo, Cindy of Samoa, Simon Clark, Luci Hare, Yvonne Maea-Brown, James Maeva, Tim Waikiki Mitipelo, Lydia Peckham, David Tua","Two brothers; Alama and Popo, arrive for the first time in NZ as Seasonal Workers, making plenty of money to take back home to their family in Samoa. But things take a turn for the worst ...",4.8,131,,,$ 648530,,6.0,3.0
tt9591082,"Tarp musu, mergaiciu","Tarp musu, mergaiciu",2018,2018-12-28,Comedy,90,Lithuania,Lithuanian,Kestutis Gudavicius,,Vabalo Filmai,"Rimante Valiukaite, Ausra Stukyte, Emilija Latenaite-Beliauskiene, Gabriele Malinauskaite, Rasa Marazaite, Ineta Stasiulyte","What women talk about, when men are not around.",3.8,107,,,$ 685082,,2.0,
tt9595506,So Pretty,So Pretty,2019,2019-02-10,Drama,83,"USA, France","English, German",Jessica Dunn Rovinelli,"Jessica Dunn Rovinelli, Ronald M. Schernikau",100 Year Films,"Edem Dela-Seshie, Thomas Love, Rachika Samarth, Jessica Dunn Rovinelli, Phoebe DeGroot, Arlene Gregoire",Four queer and trans youth in New York City struggle to maintain their proto-utopian community against the outside world as their lives curiously merge with the 1980s German novel So Schön by Ronald M. Schernikau.,5.2,303,,,,,3.0,5.0
tt9596638,Da ren wu,Da ren wu,2019,2019-01-10,"Action, Crime",107,China,Mandarin,Bai Wu,"Zisheng Guo, Rongrong Hu",QC Media,"Brono Bajtala, Bei-Er Bao, Yuan Du, Yuexi Gai, Yezhou Han, Qing Huo, Han Jiang, Gangshan Jing, Jack Kao, Zhanwen Kou, Beilei Li, Mintao Liu, Tianzuo Liu, Xiaolin Lü, Jingjing Ma",A car fixer jumps off stairs after illegal demolition. Police officer tries to find the crime and catch the evil boss.,5.8,167,,,$ 56040681,,,1.0
tt9597190,Fei chi ren sheng,Fei chi ren sheng,2019,2019-02-05,"Comedy, Sport",98,China,Mandarin,Han Han,Han Han,Alibaba Pictures,"Teng Shen, Johnny Huang, Zheng Yin, Benyu Zhang, Fang Yin, Yu Tian, Xiang Wei, Shaofeng Feng, Winston Chao, Tengger, Pierre Bourdaud, Gaoxiang Fan, Huayang Gao, Sui He, Bing Li",An old-time racing champion tries to come back to the race track.,6.2,1305,,,$ 255863112,,13.0,9.0
tt9598172,Spasti Leningrad,Spasti Leningrad,2019,2019-02-10,"Action, Drama, War",96,Russia,Russian,Aleksey Kozlov,Aleksey Kozlov,Studio AVK,"Maria Melnikova, Andrey Mironov-Udalov, Gela Meskhi, Anastasiya Melnikova, Valeriy Degtyar, Marina Komarova, Vitaliy Kishchenko, Aleksey Shevchenkov, Boris Shcherbakov, Inga Strelkova-Oboldina, Yeseniya Rayevskaya, Sergey Zharkov, Ivan Lyrchikov, Vadim Andreev, Vladimir Petrov",September 1941. In a turn of events young lovebirds Kostya and Nastya find themselves on board of a barge that will evacuate people from sieged Leningrad. At night the barge gets into the ...,5.8,931,,,$ 3068838,,10.0,3.0
tt9598270,Code Geass: Lelouch of the Rebellion Episode II,Code Geass: Lelouch of the Rebellion Episode II,2018,2018-02-10,"Animation, Action, Sci-Fi",132,Japan,Japanese,Gorô Taniguchi,"Gorô Taniguchi, Ichirô Ôkouchi",,"Jun Fukuyama, Takahiro Sakurai, Omi Minami, Yukana Nogami, Ami Koshimizu, Junko Minagawa, Kaori Nazuka, Norio Wakamoto, Akeno Watanabe, Fumiko Orikasa, Sayaka Ôhara, Tetsu Shiratori, Takahiro Mizushima, Mitsuaki Madono, Ken Narita",A remake of the last 8 episodes of Code Geass R1 and the first 16 episodes of Code Geass R2.,7.1,172,,,$ 526114,,,2.0
tt9598594,Üç Harfliler: Adak,Üç Harfliler: Adak,2019,2019-01-18,"Horror, Thriller",91,Turkey,Turkish,Alper Mestçi,Alper Mestçi,Muhtesem Film,"Sebahat Adalar, Ali Aydogan, Ramazan Demir, Begüm Koyçiç, Simge Uluer, Ceren Yilmaz, Cavit Özer, Ejder Özkarsligil","Salih was shot with a rifle in the forest where he went hunting with his friend Metin. Salih, who had to live with bullets in his brain, needs both material and spiritual help to heal. ...",6.6,407,,,$ 548237,,2.0,
tt9601220,Black Bear,Black Bear,2020,2020-01-24,Drama,104,USA,English,Lawrence Michael Levine,Lawrence Michael Levine,Blue Creek Pictures,"Alexander Koch, Aubrey Plaza, Sarah Gadon, Christopher Abbott, Lindsay Burdge, Paola Lázaro, Jennifer Kim, Shannon O'Neill, Grantham Coleman, Lou Gonzalez","A filmmaker at a creative impasse seeks solace from her tumultuous past at a rural retreat, only to find that the woods summon her inner demons in intense and surprising ways.",7.3,125,,,,82.0,2.0,10.0
tt9602258,Malmoi,Malmoi,2019,2019-01-09,"Comedy, Drama, History",135,South Korea,"Korean, Japanese",Yu-na Eom,Yu-na Eom,The Lamp,"Hae-Jin Yoo, Kyung-ho Yoon, Hong-pa Kim, Hyeon Woo, Tae-Hoon Kim, Sun-young Kim, Hyun-Chul Cho, Gwi-hwa Choi, Joon-woo Goo, Sung-tae Heo, Jin-ki Jeon, Gi-seop Jeong, Won-Ho Ji, Hyun-Do Jo, Do-Yeob Kim",Set in the 1940's when Korea was under Japanese occupation. Korean people were banned from speaking their own language during that time.,6.3,206,KRW 11500000000,,$ 21083522,,3.0,2.0
tt9602378,Good Kisser,Good Kisser,2019,2020-05-24,"Comedy, Drama, Romance",80,USA,English,Wendy Jo Carlton,Wendy Jo Carlton,Good Kisser,"Kari Alison Hodge, Julia Eringer, Courtney McCullough, Rachel Paulson, Carter Rodriquez","Jenna and Kate open up their relationship to an alluring stranger in the hopes of spicing up their two-year romance, only for it to expose the faults in their foundation.",4.4,139,,,,,1.0,4.0
tt9608818,The Friend,The Friend,2019,2019-09-06,Drama,124,USA,English,Gabriela Cowperthwaite,Brad Ingelsby,Black Bear Pictures,"Dakota Johnson, Casey Affleck, Jason Segel, Gwendoline Christie, Cherry Jones, Ahna O'Reilly, Reed Diamond, Violet McGraw, Azita Ghanizada, Michael Papajohn, Marielle Scott, Ritchie Montgomery, T.C. Matherne, Chandler Head, Isabella Kai","After receiving life-altering news, a couple finds unexpected support from their best friend, who puts his own life on hold and moves into their family home, bringing an impact much greater and more profound than anyone could have imagined",7.4,248,,,,44.0,1.0,14.0
tt9610262,Chaal Jeevi Laiye,Chaal Jeevi Laiye,2019,2019-03-15,Drama,137,India,Gujarati,Vipul Mehta,"Jainesh Ejardar, Vipul Mehta",Coconut Motion Pictures,"Siddharth Randeria, Yash Soni, Aarohi Patel, Bhavik Bhojak, Aruna Irani","In his quest to become successful, Aditya Parikh puts life on the back burner, including his Father Bipin Chandra Parikh. Infuriated and heartbroken, the father persuades his monotonous son...",8.6,557,,,$ 100113,,18.0,
tt9610354,Ninnu Thalachi,Ninnu Thalachi,2019,2019-09-27,"Comedy, Romance",138,India,Telugu,Anil Thota,,Nedurumalli Productions,"Mahesh Achanta, Anand, Naveen Neni, Stefy Patel, Kedar Shankar, Krishna Teja, Vamsi Yakasiri","Abhiram (Vamsi Yakasiri) is a happy-go-lucky guy, who falls in love at first sight with a girl named Ankitha tries very hard to explain his feeling to her. On the other hand, she loves ...",9.3,924,INR 40000000,,,,4.0,
tt9611484,Quezon's Game,Quezon's Game,2018,2019-05-29,"Drama, History",127,Philippines,English,Matthew E. Rosen,"Janice Y. Perez, Dean Rosen",Star Cinema,"Raymond Bagatsing, Rachel Alejandro, Kate Alejandrino, Billy Ray Gallion, David Bianco, Jennifer Blair-Bianco, Tony Ahn, James Paoleli, Jeremy Domingo, Ross Barnaby McLeod, Natalia Moon","In 1938, Philippine President Manuel L. Quezon agrees to welcome Jewish refugees from Germany in the Philippines.",7.5,117,$ 500000,,$ 5986,36.0,15.0,17.0
tt9612136,Madha,Madha,2020,2020-03-13,"Mystery, Thriller",113,India,Telugu,Srividya Basawa,Prashanth Sagar Atlluri,Third Eye Productions,"Trishna Mukherjee, Rahul Venkat, Anish Kuruvilla, Bikramjeet Kanwarpal, Bunny Abiran, Ajay, Darbha Appaji Ambarisha, Harshad Babu, Qudrat Bhatia, Vijay Bhatia, Bramha, Shailja Chaturvedi, Tanuj Chauhan, Pramodh Choudary, Mohan Chowdary","MADHA is a Sanskrit term which means ""insanity personified"". MADHA is a female-centered psychological thriller that revolves around a small-time proofreader Nisha.",5.4,444,,,,,55.0,7.0
tt9612368,An English Haunting,An English Haunting,2020,2020-04-06,Horror,89,UK,English,Charlie Steeds,Charlie Steeds,Dark Temple Motion Pictures,"David Lenik, Tessa Wood, Barrington De La Roche, Emma Spurgin Hussey, Jéssica Alonso, Rory Wilton, Swainley Whipps Eden-Entwistle, Richard D. Myers, Mark Jones, Klay Mobius Trip","In 1960s England, Blake Cunningham and his alcoholic mother are forced to move into the mysterious Clemonte Hall, a vast isolated manor house, to care for his dying Grandfather who resides ...",4.2,222,,,,,20.0,12.0
tt9612982,Il figlio del diavolo,The Assent,2019,2020-01-10,"Horror, Thriller",93,"Israel, USA, UK","English, Latin, French",Pearry Reginald Teo,Pearry Reginald Teo,Boom Done Productions,"Robert Kazinsky, Peter Jason, Florence Faivre, Caden Dragomer, Hannah Ward, Douglas Spain, Eileen Dietz, Margarita Reyes, Obada Adnan, Luca Bleu Darnell, William ""Will"" Daubert, Megan Henry, Bryan James, Austin McMains, Tatum O'Neal","After a series of disturbing supernatural events in his home, Joel, a young single father, comes to suspect that his young son may be possessed.",4.0,1039,,,$ 449458,,28.0,19.0
tt9613316,Frances Ferguson,Frances Ferguson,2019,2019-11-28,Comedy,74,USA,English,Bob Byington,"Bob Byington, Kaley Wheless",The Substitute,"Kaley Wheless, Nick Offerman, Martin Starr, Jennifer Prediger, Ella Dolan, Mark Miller, Jaley Shaner, Jake French, Keith Poulson, Jack William Marshall, Dylan Cimbala, Yoko Lawing, Paul Sitzman, Sandy Booth, John Gatins",A small town's reaction to scandal.,6.1,355,$ 500000,,,,18.0,18.0
tt9614416,Blackia,Blackia,2019,2019-05-03,Drama,141,India,Punjabi,Sukhminder Dhanjal,"Inderpal, Gurjant Singh Marahar",Ohri Productions pvt ltd,"Dev Kharoud, Ihana Dhillon, Sanju Solanki, Ravinder Mand, Parmod Pabbi, Aashish Duggal, Arsh Hundal, Ekkta bp Singh, Naginder Gakhar, Lucky Dhaliwal, Kumar John, Rana Jung Bahadur, Goni Sagoo, Rajat Manchanda, Sharanpreet","During the gold smuggling at international Punjab's border in the 70's, an innocent college boy gets involved in the gang war and takes over the underworld.",6.5,109,,,$ 69193,,2.0,1.0
tt9614440,Mickey and the Bear,Mickey and the Bear,2019,2019-11-13,Drama,88,USA,English,Annabelle Attanasio,Annabelle Attanasio,Thick Media Co.,"Camila Morrone, James Badge Dale, Calvin Demba, Ben Rosenfield, Rebecca Henderson, Stephen Little, Joel Scheett, Kelley D. Cutler, Katee Ferguson, Suzie A. Burch, Don Capp, Steven D. Collins, Gina Mohr, Jen Anderson, Colten Ferguson","Faced with the responsibility to take care of her addict, veteran father, headstrong teen Mickey Peck keeps her household afloat.",6.6,873,,$ 57188,$ 57188,79.0,16.0,25.0
tt9614460,Chhapaak,Chhapaak,2020,2020-01-10,"Biography, Drama",120,India,Hindi,Meghna Gulzar,"Atika Chohan, Meghna Gulzar",Fox STAR Studios,"Deepika Padukone, Vikrant Massey, Madhurjeet Sarghi, Payal Nair, Vaibhavi Upadhyay, Geeta Agarwal, Vishal Dahiya, Ankit Bisht, Satish Sharma, Anand Tiwari, Ipshita Chakraborty Singh, Devas Dixit, Delzad Hiwale, Sanjay Gurbaxani, Annapurna Soni","The trials and triumphs of Malti, an acid attack survivor. From the investigation of the attack to the court proceedings, the medical treatment to the emotional healing. Chhapaak is the story of the unquashable human spirit.",5.1,23866,,$ 604334,$ 6532100,,1299.0,21.0
tt9614772,Geetha,Geetha,2019,2019-09-27,"Drama, Romance",148,India,Kannada,Vijay Naagendra,,Golden Movies,"Ganesh, Shanvi Srivastava, Parvathy Arun, Prayaga Martin, Devaraj, Sudharani, Aarti, Akash, Anand, Kumar Arasegowda, Bharath, Ravi Bhat, Chiranth, Fakirappa, Vihaan Ganesh","Akash, a software professional who comes from a broken home, is a cynical younger who does not really believe in the idea of love. But when he learns about his father's past and encounters love in close proximity in his life, does he find a happy ending?",6.1,116,,,,,2.0,2.0
tt9614950,Thirumanam,Thirumanam,2019,2019-03-01,Drama,156,India,Tamil,Cheran,Cheran,Preniss International,"Cheran, Sukanya","Very much concerned about his family's financial status, Arivudainambi is unhappy with the way his sister's wedding to a wealthy man is being done.",6.5,111,,,$ 5165,,5.0,3.0
tt9614988,Sillu Karuppatti,Sillu Karuppatti,2019,2019-12-27,"Drama, Romance",153,India,Tamil,Halitha Shameem,Halitha Shameem,Divine Productions,"Sara Arjun, Manikandan, Nivedhithaa Sathish, Leela Samson, Samuthirakani, Sunaina",An anthology of four romantic stories across four age groups connected by that magical thread called love.,8.2,1104,,,,,30.0,3.0
tt9614994,Rabb Da Radio 2,Rabb Da Radio 2,2019,2019-03-29,Drama,129,India,Punjabi,Sharan Art,Jass Grewal,Vehli Janta Films,"Tarsem Jassar, Simi Chahal, Tania, Harby Sangha, Sunita Dhir, Jagjeet Sandhu, Wamiqa Gabbi, Ranjit Bawa, Avtar Gill, Gurpreet Bhangu, Lakha Lehri, Baljinder Kaur, Prakash Gadhu, Parminder Gill, Jasbir Gill",A newly married man returns home and is saddened to learn his extended family has split apart.,7.0,196,,,$ 201416,,7.0,
tt9615016,Dhilluku Dhuddu 2,Dhilluku Dhuddu 2,2019,2019-02-07,"Comedy, Horror",119,India,Tamil,Rambala,Rambala,Handmade films,"Santhanam, Shritha Sivadas, Motta Rajendran, Bipin, Urvashi, Shivashankar, G. Marimuthu, T.M. Karthik Srinivasan, Ramar","Due to the black magic protecting Maya, anyone who falls in love with her ends up mysteriously killed, so Vijay tries to get rid of the magic.",5.3,504,,,$ 45502,,8.0,3.0
tt9615020,Natpe Thunai,Natpe Thunai,2019,2019-04-04,"Comedy, Drama, Sport",154,India,Tamil,Parthiban Desingu,"Devesh Jeyachandran, Sreekanth",Avni Movies,"Hiphop Tamizha Adhi, Anagha, Karu Palaniappan, Kousalya, Sha Ra, R.J. Vignesh, Pandiarajan, Harish Uthaman, Vijay Kumar Rajendran, Ashwin Jerome, Bijili Ramesh, Raj Mohan, Tigergarden Thangadurai, Guhan Prakash, Chutti Aravind",An international hockey player who has chosen to leave the sport picks it up again to save the ground of a local team.,6.5,684,,,$ 10374,,22.0,4.0
tt9615278,Abou Leila,Abou Leila,2019,2020-07-15,"Drama, Mystery, Thriller",135,"Algeria, France, Qatar",Arabic,Amin Sidi-Boumédiène,Amin Sidi-Boumédiène,Thala Films Production,"Slimane Benouari, Lyès Salem, Azouz Abdelkader, Fouad Megiraga, Meriem Medjkrane, Hocine Mokhtar, Samir El Hakim","Algeria, 1994. S. and Lotfi, two childhood friends, cross the desert in search of Abu Leila, a dangerous terrorist.",5.9,160,,,$ 55581,,,9.0
tt9616700,Adú,Adú,2020,2020-06-30,Drama,119,Spain,"French, English, Spanish",Salvador Calvo,Alejandro Hernández,Ikiru Films,"Luis Tosar, Álvaro Cervantes, Anna Castillo, Moustapha Oumarou, Miquel Fernández, Jesús Carroza, Adam Nourou, Zayiddiya Dissou, Ana Wagener, Nora Navas, Issaka Sawadogo, Bella Agossou, Josean Bengoetxea, Eliane Chagas, Koffi Gahou","Three people, three stories, one thing in common: Africa.",6.7,1693,,,$ 7085946,,18.0,12.0
tt9617578,It Started as a Joke,It Started as a Joke,2019,2019-03-10,Documentary,76,,,"Julie Smith Clem, Ken Druckerman",,Left/Right,"Michael Ian Black, Wyatt Cenac, Jo Firestone, Jon Glaser, Ira Glass, Bobcat Goldthwait, John Hodgman, Eugene Mirman, Aparna Nancherla, Kumail Nanjiani, Kristen Schaal, Michael Showalter, Reggie Watts","A look at the decade-long run of the Eugene Mirman Comedy Festival in Brooklyn, the alternative comedy scene in New York, and Eugene's personal life.",7.1,112,,,,,2.0,7.0
tt9619402,El Que Se Enamora Pierde,El Que Se Enamora Pierde,2019,2019-01-03,Comedy,90,Colombia,Spanish,Fernando Ayllón,,,"Joavany Alvarez, Linda Baldrich, María Cecilia Botero, Lorna Cepeda, Bruno Díaz, Iván Marín, Alejandro Palacio, Liss Pereira, Ricardo Quevedo, Carolina Sarmiento, Ivan Rene Valenciano","She's single, pregnant and fighting for the job of her dreams. The last thing she needs is to fall in love.",5.2,107,,,$ 537185,,,1.0
tt9619798,La Missy sbagliata,The Wrong Missy,2020,2020-05-13,"Comedy, Romance",90,USA,English,Tyler Spindel,"Chris Pappas, Kevin Barnett",Happy Madison Productions,"David Spade, Lauren Lapkus, Nick Swardson, Geoff Pierson, Jackie Sandler, Molly Sims, Sarah Chalke, Chris Witaske, Rob Schneider, John Farley, Jorge Garcia, Joe Anoa'i, Jonathan Loughran, Jared Sandler, Chris Titone","Tim thinks he's invited the woman of his dreams on a work retreat to Hawaii, realizing too late he mistakenly texted someone from a nightmare blind date.",5.7,28650,,,,33.0,567.0,70.0
tt9620292,Promising Young Woman,Promising Young Woman,2020,2020-07-17,"Comedy, Crime, Drama",113,"UK, USA",English,Emerald Fennell,Emerald Fennell,FilmNation Entertainment,"Carey Mulligan, Bo Burnham, Laverne Cox, Clancy Brown, Jennifer Coolidge, Alison Brie, Christopher Mintz-Plasse, Molly Shannon, Angela Zhou, Sam Richardson, Connie Britton, Steve Monroe, Casey Adams, Francisca Estevez, Timothy E. Goodwin","A young woman, traumatized by a tragic event in her past, seeks out vengeance against those who cross her path.",6.5,349,,,,74.0,4.0,52.0
tt9621284,The Last Right,The Last Right,2019,2019-12-06,"Comedy, Drama",106,Ireland,English,Aoife Crehan,Aoife Crehan,CrossDay Productions Ltd.,"Niamh Algar, Samuel Bottomley, Cian Boylan, Brian Cox, Luke Hanlon, Michiel Huisman, Sarah Caitriona Lynch, Louise Mathews, Kevin McCormack, Michael McElhatton, Colm Meaney, Brian Matthews Murphy, Donna Anita Nikolaisen, Jim Norton, Eleanor O'Brien",A fateful exchange on a flight has consequences for Daniel Murphy. He's left in charge of a corpse of someone he never knew. He is persuaded to take on the challenge of getting a coffin from his family home in Clonakilty to Rathlin Island.,5.8,280,,,$ 88725,,16.0,2.0
tt9624470,Gromkaya svyaz,Gromkaya svyaz,2019,2019-02-14,Comedy,96,Russia,Russian,Aleksey Nuzhnyy,Leonid Barats,,"Anastasiya Ukolova, Leonid Barats, Irina Gorbacheva, Rostislav Khait, Mariya Mironova, Kamil Larin, Veronika Kornienko, Aleksandr Demidov, Anastasia Yaseva","Seven friends, having gathered in a country house, begin to play the game in a joke - participants must read out aloud all messages that come to them, and answer calls only via speakerphone...",6.6,897,,,$ 8864882,,3.0,
tt9624686,Tottumiskysymys,Tottumiskysymys,2019,2019-09-27,"Comedy, Drama",75,Finland,"Finnish, English","Reetta Aalto, Alli Haapasalo","Reetta Aalto, Alli Haapasalo",Tuffi Films,"Veikko Aalste, Teemu Aromaa, Suvi Blick, Tommi Eronen, Seidi Haarla, Joel Hirvonen, Johannes Holopainen, Leo Honkonen, Niina Hosiasluoma, Nelli Juusela, Lotta Kaihua, Ona Kamu, Ria Kataja, Elina Knihtilä, Tommi Korpela",A film by seven directors shows us moments in women's lives that usually remain hidden. Force of Habit follows the lives of various women throughout one day.,7.0,285,EUR 400000,,,,,1.0
tt9625240,Nevia,Nevia,2019,2019-09-05,Drama,86,Italy,Italian,Nunzia De Stefano,"Nunzia De Stefano, Chiara Ridolfi",Archimede,"Virginia Apicella, Pietra Montecorvino, Rosy Franzese, Pietro Ragusa, Franca Abategiovanni, Simone Borrelli, Lola Bello Durojaiye, Gianfranco Gallo","Nevia, a Neapolitan girl that comes from a poor family, joins a circus, trying to escape from poverty.",5.7,131,,,,,,7.0
tt9625632,Mes jours de gloire,Mes jours de gloire,2019,2020-02-26,Comedy,98,France,French,Antoine de Bary,"Elias Belkeddar, Antoine de Bary",Iconoclast,"Vincent Lacoste, Emmanuelle Devos, Christopher Lambert, Noée Abita, Damien Chapelle, Marc Fraize, Antoine Poulet, Jochen Hägele, Pierre Maillard, Thomas Blumenthal, Nordine Bouazzaoui, Jules Dieng, Margot Marie Ménéguz, Régis Marvin Merveille N'Kissi Moggzi, Mahia Zrouki",An actor who enjoyed success in his youth finds his career and life in a downward spiral as he gets older.,5.7,249,,,$ 204055,,1.0,4.0
tt9625664,Trauma Center,Trauma Center,2019,2019-12-06,"Action, Thriller",87,USA,"English, Spanish",Matt Eskandari,Paul Da Silva,Emmett/Furla/Oasis Films (EFO Films),"Nicky Whelan, Bruce Willis, Tito Ortiz, Texas Battle, Catherine Davis, Sergio Rizzuto, Tyler Jon Olson, Roman Mitichyan, Jonathan Galanis, Steve Guttenberg, Carroll 'Pinky' Duwart III, Jaime Irizarry, Koldo Fombellida, Leslee Emmett, Katira Maria","Alone and trapped in a locked-down hospital, an injured young woman must escape a pair of vicious killers who are after the only piece of evidence that can implicate them in a grisly murder, the bullet in her leg.",4.6,5367,,,$ 92968,,256.0,24.0
tt9626278,Fourteen,Fourteen,2019,2020-01-16,Drama,94,USA,English,Dan Sallitt,Dan Sallitt,Static Prods.,"Tallie Medel, Norma Kuhling, Lorelei Romani, C. Mason Wells, Dylan McCormick, Kolyn Brown, Willy McGee, Scott Friend, Evan Davis, Ben Sloane, Caroline Luft, Strawn Bovee, Solya Spiegel, Aundrea Fares, Jesse Hochstadt","Over the course of a decade, a young woman becomes increasingly dysfunctional due to undiagnosed mental illness, or perhaps to drugs, while her more stable friend sometimes tries to help, sometimes backs away to preserve herself.",6.9,303,$ 95000,,,79.0,,108.0
tt9626764,Ekipa,Ekipa,2019,2019-10-24,"Comedy, Crime",96,Serbia,Serbian,Marko Sopic,Rade Cosic,,"Rade Cosic, Andrija Milosevic, Ivana Dudic, Dragan Jovanovic, Srdjan 'Zika' Todorovic, Ljubomir Bandovic, Milos Timotijevic, Lazar Djukic, Andjela Jovanovic, Ratko Tankosic, Nikola Ristanovski, Sergej Trifunovic, Ljiljana Stjepanovic, Ivan Ivanovic-Juice, Aleksandar Lazic",Following an unfortunate accident popular Partizan Belgrade footballer Zdravko risks his life and livelihood when he becomes involved with the mob.,4.5,478,,,$ 247752,,6.0,2.0
tt9626774,Amar,Amar,2019,2019-05-31,"Action, Drama, Romance",132,India,Kannada,Nagashekar,Nagashekar,Sandesh Productions,"Abishek Ambareesh, Tanya Hope, Devaraj, Sadhu Kokila, Chikkanna, Anup Bhandari, Rachita Ram, Sudha Rani, Deepak Shetty, Darshan Thoogudeep",Amar is a rich industrialist who lives life without worries. A chance video of the love of his life as a nun in Switzerland makes him relive his romance and set out to find her. What is the reason for her to take up this way of life?,5.2,121,,,,,8.0,1.0
tt9628392,Mayabazaar 2016,Mayabazaar 2016,2020,2020-02-28,"Comedy, Crime, Drama",133,India,Kannada,Radhakrishna Reddy,,PRK Productions,"Prakash Raj, Raj B. Shetty, Vasishta N. Simha, Achyuth Kumar, Abhi, Shravan Aithal, Anbu, Anjinappa, Aravind, Balaji, Harish Bellary, Raghu Bhat, Kila Kila Chandru, Chethan Charly, Chitkala","An honest cop, a conman and a hopeless romantic form an unusual team during the days of demonetisation to pull off a scam. A scam that is bigger than demonetisation, but things go haywire.",7.1,437,,,,,13.0,2.0
