imdb_title_id,title,original_title,year,date_published,genre,duration,country,language,director,writer,production_company,actors,description,avg_vote,votes,budget,usa_gross_income,worlwide_gross_income,metascore,reviews_from_users,reviews_from_critics
tt9407490,Freies Land,Freies Land,2019,2020-01-09,"Crime, Drama, Thriller",129,Germany,"German, French",Christian Alvart,"Siegfried Kamml, Christian Alvart",Syrreal Entertainment,"Trystan Pütter, Nurit Hirschfeld, Felix Kramer, Oleksandr Pecherytsia, Uwe Dag Berlin, Leonard Kunz, Andrei Korzhenevsky, Marius Marx, Nora von Waldstätten, Alva Schäfer, Katja Matcibora, Asia Luna Mohmand, Liza Koslova, Ludwig Simon, Ute Lubosch","Two cops investigate the disappearance of two teen sisters in a remote town, where it seems like everyone has something to hide - including the bodies.",6.8,275,,,$ 297983,,1.0,38.0
tt9408490,Lai dian kuang xiang,Lai dian kuang xiang,2018,2018-12-29,Drama,90,China,Mandarin,Miao Yu,"Xiao Li, Huan Wang",Beijing Culture,"Dawei Tong, Li Ma, Siyan Huo, Shan Qiao, Yu Tian, Lele Dai, Ming Xi, Lun Ai, Morning Chang, Xinyu Han, Hongshan He, Clara Lee, Bingxi Li, Ping Li, Jian Liu","A group of seven friends decide to play a game at a dinner party. Placing each of their phones on the table, they agree to share the content of every message they receive. However, it soon ...",5.7,268,,,$ 94870905,,4.0,5.0
tt9411866,The Roads Not Taken,The Roads Not Taken,2020,2020-03-13,Drama,85,"UK, Sweden, USA, Poland, Spain",English,Sally Potter,Sally Potter,Adventure Pictures,"Javier Bardem, Elle Fanning, Branka Katic, Salma Hayek, Dimitri Andreas, Katia Mullova-Brind, Milena Tscharntke, Debora Weston, Aaron Joshua, Sabina Cameron, Griffin Stevens, Laura Linney, Catherine Levi, Ruth Keeling, Olan Montgomery","Sally Potter's film follows a day in the life of Leo (Javier Bardem) and his daughter, Molly (Elle Fanning), as he floats through alternate lives he could have lived, leading Molly to wrestle with her own path as she considers her future.",4.9,753,,$ 3518,$ 3518,39.0,21.0,43.0
tt9411900,Revenir,Revenir,2019,2020-01-29,Drama,77,France,French,Jessica Palud,"Diastème, Serge Joncour",Fin Août Productions,"Niels Schneider, Adèle Exarchopoulos, Roman Coustère Hachez, Patrick d'Assumçao, Hélène Vincent, Franck Falise, Jonathan Couzinié, Catherine Salée",A man in his early thirties returns to the rural farm of his childhood and rejoins the family struggle to get by.,6.1,189,,,$ 135628,,,4.0
tt9412268,Furie,Hai Phuong,2019,2019-02-22,"Action, Drama, Thriller",98,Vietnam,Vietnamese,Le-Van Kiet,Kay Nguyen,Premiere Picture,"Veronica Ngo, Mai Cát Vi, Thanh Nhien Phan, Pham Anh Khoa, Kim Long Thach, Khanh Ngoc Mai, Hoa Thanh, Pompatama, Trang Le, Hien Trang, Voi Tuan, Jack Lee, Minh Le, Lê Bình, YaYa Truong Nhi","Veronica Ngo stars as an ex-gangster who is lying low in the countryside after becoming a mother, but she can't escape her violent past when her daughter is kidnapped.",6.3,3598,,$ 594788,$ 5756185,,59.0,44.0
tt9412514,L'angle mort,L'angle mort,2019,2019-10-16,Drama,104,France,French,"Patrick-Mario Bernard, Pierre Trividic","Patrick-Mario Bernard, Emmanuel Carrère",Ex Nihilo,"Jean-Christophe Folly, Isabelle Carré, Golshifteh Farahani, Sami Ameziane, Claudia Tagbo, Tella Kpomahou, Elliot Jenicot, Peter Bonke, Hugues Jourdain, Yannis Bougeard, Jessica Leyemberger, Sébastien Floche, Aude Lachaise, João Fernando Amorim Cabral Filho, Martine Schambacher","Dominick Brassan has the power to turn invisible, but he keeps it a shameful secret. Then, when his ability to control his gift gets out of hand, his life, friendships and relationships will be forever turned inside out.",5.7,173,,,,,1.0,7.0
tt9415552,Nesokrushimyy,Nesokrushimyy,2018,2018-10-25,"Action, Drama, History",90,Russia,Russian,Konstantin Maksimov,"Valeriya Baykeeva, Valeriya Baykeeva",Mosfim,"Andrey Chernyshov, Vladimir Epifantsev, Oleg Fomin, Olga Pogodina, Sergey Gorobchenko, Nikolay Dobrynin, Vasiliy Sedykh, Vladimir Kochetkov, Dmitriy Zolotukhin, Olga Aksenova, Maria Arnaut, Yuriy Balitskiy, Daniil Bogdanov, Oleg Chudnitsov, Anton Eskin","The movie inspired by real events tells the story of the KV-1 tank's crew heroic deed. Having a losing fight, the crew of Semyon Konovalov destroyed 16 enemy tanks, 2 armored vehicles and 8...",5.3,1359,RUR 300000000,,,,9.0,4.0
tt9418812,Hello World,Hello World,2019,2020-03-09,"Animation, Comedy, Drama",97,Japan,Japanese,Tomohiko Itô,Mado Nozaki,CyberAgent,"Haruka Fukuhara, Minami Hamabe, Takumi Kitamura, Minako Kotobuki, Takehito Koyasu, Rie Kugimiya, Tôri Matsuzaka",A man travels in time from the year 2027 to relive his school years and to correct a bad decision.,6.8,857,,,$ 4449860,,12.0,4.0
tt9418878,Kiz Kardesler,Kiz Kardesler,2019,2019-09-13,Drama,108,"Turkey, Germany, Netherlands, Greece",Turkish,Emin Alper,Emin Alper,Circe Films,"Cemre Ebuzziya, Ece Yüksel, Helin Kandemir, Müfit Kayacan, Kayhan Açikgöz, Kubilay Tunçer, Hilmi Özçelik, Basak Kivilcim Ertanoglu, Emin Alper, Selim Gunturkun, Ibrahim Kestane, Akin Baspehlivan, Mehmet Akin","Three young girls are sent back to their father in a poor village in central Anatolia, one after another, after failing in more affluent foster families.",7.5,2171,,,$ 92931,,5.0,37.0
tt9419834,Secret Obsession,Secret Obsession,2019,2019-07-18,"Drama, Mystery, Thriller",97,USA,English,Peter Sullivan,"Kraig Wenman, Peter Sullivan",Hybrid,"Brenda Song, Mike Vogel, Dennis Haysbert, Ashley Scott, Paul Sloan, Daniel Booko, Scott Peat, Blair Hickey, Michael Patrick McGill, Casey Leach, Jim Hanna, Ciarra Carter, Eric Etebari, Kati Salowsky, Jennifer Peo","Recuperating from trauma, Jennifer remains in danger as she returns to a life she doesn't remember.",4.3,17103,,,,,721.0,32.0
tt9420624,Orang Kaya Baru,Orang Kaya Baru,2019,2019-01-24,"Comedy, Drama",96,Indonesia,Indonesian,Ody C. Harahap,Joko Anwar,Screenplay Films,"Cut Mini Theo, Lukman Sardi, Raline Shah, Derby Romero, Fatih Unru, Refal Hady, Millane Fernandez, Melayu Nicole, Jasmine Kusuma Carroll, Arvitta Ludya, Verdi Solaiman, Sylvia Genpati, T.M. Tarsan, Reza Nangin, Ikram Kribo","A life of a ordinary family consists of father (Lukman Sardi), mother (Cut Mini) and three children Duta (Derby Romero), Tika (Raline Shah) and Dodi (Fatih Unru) suddenly changed when the father died and left a legacy a lot of wealth.",6.4,430,,,,,4.0,5.0
tt9420648,Bala,Bala,2019,2019-11-07,Comedy,133,India,Hindi,Amar Kaushik,"Niren Bhatt, Ravi Shankar Muppa",Maddock Films,"Ayushmann Khurrana, Bhumi Pednekar, Yami Gautam, Saurabh Shukla, Javed Jaffrey, Sunita Rajwar, Seema Bhargava, Abhishek Banerjee, Umesh Shukla, Dheerendra Gautam, Deepika Chikhalia, Sachin Chaudhary, Saniya Touqeer, Sunheri Shah, Ranjan Raj",It tells the story of a man who is balding prematurely and how he copes up with the situation.,7.4,10652,,,$ 1447766,,164.0,16.0
tt9425078,Verotika,Verotika,2019,2019-06-13,Horror,90,USA,English,Glenn Danzig,Glenn Danzig,Dark Risen Pictures,"Ashley Wisdom, Rachel Alig, Alice Tate, Kayden Kross, Scotch Hopkins, Sean Kanan, Natalia Borowsky, Nika Balina, Jody Barton, Brennah Black, Kris Black, Kansas Bowling, James Cullen Bressack, Katarina Bucevac, Cody Renee Cameron","Glenn Danzig's directorial debut, is a horror anthology that compiles stories from Danzig's line of comic books of the same name. Stories which focus on horror content that's often sexual ...",1.9,959,$ 1000000,,,,41.0,37.0
tt9426186,Revenger,Revenger,2018,2018-12-06,"Action, Crime, Thriller",101,South Korea,"Korean, English",Seung-Won Lee,Bruce Khan,Green Fish Pictures,"Je-Heon Choi, SooJin Jeong, Bruce Khan, In-kwon Kim, Chul-min Park, Hee-soon Park, Jin-Seo Yoon",A former police investigator decides to go to a prison island to revenge the brutal killings of his family.,5.7,3367,,,,,66.0,22.0
tt9426210,Weathering with You,Tenki no ko,2019,2019-10-14,"Animation, Drama, Family",112,"Japan, China",Japanese,Makoto Shinkai,Makoto Shinkai,"""Weathering With You"" Film Partners","Kotaro Daigo, Nana Mori, Shun Oguri, Sei Hiraizumi, Yûki Kaji, Riz Ahmed, Dino Andrade, Kentaro Araki, Chieko Baishô, Ashley Boettcher, Alison Brie, Kimberly Brooks, Emma de Paauw, Brandon Engman, Erin Fitzgerald",A high-school boy who has run away to Tokyo befriends a girl who appears to be able to manipulate the weather.,7.6,16277,$ 11100000,$ 7798743,$ 193176979,72.0,177.0,110.0
tt9426974,Patrick,Patrick,2019,2020-07-23,Drama,103,Portugal,"Portuguese, French",Gonçalo Waddington,"Gonçalo Waddington, João Leitão",Augenschein Filmproduktion,"Hugo Fernandes, Alba Baptista, Lydie Barbara, João Pedro Bénard, Adriano Carvalho, Teresa Coutinho, Miguel Herz-Kestranek, Carla Maciel, Teresa Sobral, Raphaël Tschudi",About a young man on the cusp of adulthood who returns home years after being abducted as a child,6.1,101,,,,,1.0,5.0
tt9427166,Padre no hay más que uno,Padre no hay más que uno,2019,2019-08-01,Comedy,98,Spain,Spanish,Santiago Segura,"Marta González de Vega, Santiago Segura",Amazon Prime Video,"Santiago Segura, Toni Acosta, Sílvia Abril, Leo Harlem, Wendy Ramos, Martina Valeria de Antioquía, Calma Segura, Luna Fulgencio, Carlos González Morollón, Sirena Segura, Anabel Alonso, Marta González de Vega, Mónica Pérez, Diana Navarro, Miguel Lago",A family father discovers how hard is care of his five children when his wife leaves him alone with them during a week of holidays.,6.1,1651,EUR 2700000,,$ 15894372,,4.0,4.0
tt9428190,Norm of the North: King Sized Adventure,Norm of the North: King Sized Adventure,2019,2019-08-02,"Animation, Adventure, Comedy",90,"USA, India, South Korea, China",English,"Richard Finn, Tim Maltby",Dean Stefan,Assemblage,"Alan Marriott, Andrew Toth, Brian Dobson, Cole Howard, Jennifer Cameron, Jonathan Holmes, Lee Tockar, Lisa Durupt, Maya Kay, Michael Dobson, Simon Hayama, Vincent Tong","An ancient Chinese artifact has been stolen by a villainous archaeologist named Dexter. With the help of his Lemming friends, Norm must keep his word and embark on a journey across the ...",3.2,284,,,$ 1505059,,13.0,4.0
tt9430698,One Piece: Stampede,One Piece: Stampede,2019,2019-10-24,"Animation, Action, Adventure",101,Japan,"Japanese, English",Takashi Otsuka,"Eiichiro Oda, Eiichiro Oda",Toei Animation,"Felecia Angelle, Kim Anh, Tuan Anh, Major Attaway, Greg Ayres, Tia Lynn Ballard, Hoai Bao, Brian Barber, Johnny Yong Bosch, Anthony Bowling, Duncan Brannan, John Burgmeier, Charles C. Campbell, Ngoc Chau, Luci Christian",Pirates from around the world gather at the Pirates Expo to join the hunt for Gol D. Roger's lost treasure.,7.7,3512,,$ 1298528,$ 81562741,,63.0,25.0
tt9471952,Sükut Evi,Sükut Evi,2018,2018-12-21,Drama,97,Turkey,Turkish,Cafer Özgül,Cafer Özgül,Düs Gezginleri,"Melih Selcuk, Mehmet Özgür, Ece Ozdikici, Emel Çetin, Esin Eden, Fatih Topçuoglu, Yildirim Gücük, Kerem Pinar, Sehnaz B. Baftali, Pervin Bagdat, Onur Bilge, Ziya Hasipek, Halit Karaata, Merve Kizil","A young man leaves his work and his girlfriend behind for a while and leave for Anatolia. After a short while, he found himself in a friendly village in an idyllic and farce mountain ...",6.8,469,,,$ 159,,,
tt9472442,Bamse och dunderklockan,Bamse och dunderklockan,2018,2018-12-21,"Animation, Family",65,Sweden,Swedish,Christian Ryltenius,"Rune Andréasson, Fabian Nordlander",SF Studios,"Morgan Alling, Tomas Bolme, Peter Haber, Steve Kratz, Rolf Lydahl","Bamse's friends go on a quest to find the Thunderbell, the ingredient that makes Bamse strong. Meanwhile, Reinard pretends to be a good guy to supplant Bamse as the hero of the town and win the affections of Mickelina.",6.3,128,,,,,1.0,
tt9472658,Politseyskiy s Rublyovki. Novogodniy bespredel,Politseyskiy s Rublyovki. Novogodniy bespredel,2018,2018-12-20,Comedy,90,Russia,Russian,Ilya Kulikov,Ilya Kulikov,Legio Felix,"Alexander Petrov, Sergey Burunov, Tatyana Babenkova, Sofya Kashtanova, Roman Popov, Aleksandra Bortich, Rina Grishina, Irina Vilkova, Rostislav Gulbis, Sergey Shtatnov, Aleksandr Derepko, Svetlana Sukhanova, Aleksandr Buyanov, Sergey Garusov, Pavel Kizhuk","On New Year's Eve, the Barvikha-Severnoye Police Station is threatened with closure. In order to save his own department, a police officer from Rublevka Grisha Izmaylov is forced to go to ...",5.8,400,,,$ 27075595,,2.0,
tt9477520,Asuran,Asuran,2019,2019-10-04,"Action, Drama",141,India,Tamil,Vetrimaaran,"M.S. Manimaran, Poomani",V. Creations,"Dhanush, Manju Warrier, Prakash Raj, Pasupathy, Pavan, Aadukalam Naren, Ken Karunas, Tee Jay, Abhirami, A. Venkatesh, Balaji Sakthivel, Subramaniam Siva, M. Tamilarasan, Nitish Veera, Munnar Ramesh","The teenage son of a farmer from an underprivileged caste kills a rich, upper caste landlord. Will the farmer, a loving father and a pacifist by heart, be able to save his hot-blooded son is the rest of the story.",8.5,8648,INR 600000000,,$ 379728,,190.0,11.0
tt9477532,Greta,Greta,2019,2019-10-10,Drama,97,Brazil,Portuguese,Armando Praça,"Armando Praça, Fernando Mello",Carnaval Filmes,"Marco Nanini, Denise Weinberg, Demick Lopes, Gretta Star, Robério Diógenes, Edneia Tutti, Felipe De Paula, Fabiano Rocha, Fabiola Liper, Layla Sah, Júnior Martins, Pedro Domingues, Fauller, Bruno Gomes, Galba Nogueira","Pedro, a 70-year-old gay nurse, is taking care of Daniela, his ailing transgender friend. In order to find her a vacant hospital bed, he decides to help an arrested and wounded criminal to escape.",6.2,190,,,,,,12.0
tt9482230,Tommaso,Tommaso,2019,2020-06-05,Drama,115,"Italy, UK, USA, Greece","English, Italian, Russian",Abel Ferrara,Abel Ferrara,Simila(r),"Cristina Chiriac, Willem Dafoe, Anna Ferrara, Alessandro Foschetti, Stella Mastrantonio, Lorenzo Piazzoni, Alessandro Prato, Sofia Rania, Kyle Reardon, Alessandra Scarci, Dharma Mangia Woods","The story of an American artist living in Rome with his young European wife Nikki and their 3-year-old daughter, Dee Dee.",6.0,549,EUR 3000000,,$ 23588,66.0,8.0,43.0
tt9484998,Palm Springs,Palm Springs,2020,2020-07-10,"Comedy, Fantasy, Mystery",90,"USA, Hong Kong",English,Max Barbakow,Andy Siara,Limelight,"Andy Samberg, Cristin Milioti, J.K. Simmons, Peter Gallagher, Meredith Hagner, Camila Mendes, Tyler Hoechlin, Chris Pang, Jacqueline Obradors, June Squibb, Tongayi Chirisa, Dale Dickey, Conner O'Malley, Jena Friedman, Brian Duffy","When carefree Nyles and reluctant maid of honor Sarah have a chance encounter at a Palm Springs wedding, things get complicated as they are unable to escape the venue, themselves, or each other.",7.4,44712,,$ 164000,$ 338427,83.0,300.0,122.0
tt9485592,Girl Blood Sport,Girl Blood Sport,2019,2019-02-25,"Action, Fantasy, Horror",354,USA,,Russell Brown,Russell Brown,"GirlFightMovie.com, LLC","Miss Mercedes 9, Abby, Stephanie Adduci, Adelina, Delila Alas, Bianca Alexandrea, Chelsea Alexandria, Euriah Alexandria, Ali, Dezie Alvarez, Lauren Alysse, Amore, Lady Ana-Eve, Ann, Ashley Ann","Chaos follows a deadly duo of maniac assassins after they host a brutal, no-holds-barred tournament inside a sinister steel cage surrounded by razor-sharp barb-wire after luring hungry, ...",7.0,117,$ 30000,,,,1.0,
tt9487594,Menteur,Menteur,2019,2019-07-10,Comedy,111,Canada,French,Émile Gaudreault,"Eric K. Boulianne, Émile Gaudreault",Cinémaginaire Inc.,"Louis-José Houde, Antoine Bertrand, Véronique Le Flaguais, Jonathan Bergeron, Marie-Ève Bertrand, Anne-Élisabeth Bossé, Luc Bourgeois, Alexandre Bélanger, Dave Campbell, Catherine Chabot, Guillaume Champoux, Patrice Coquereau, Gabrielle Anne Desy, Patrice Ducharme, Denise Filiatrault","Simon is a compulsive liar. His family and colleagues organize an intervention but it turns into a confrontation and Simon denies everything. The next day, he wakes up in a reality where all his lies are proven facts.",6.5,587,,$ 4697364,$ 4697364,,3.0,1.0
tt9490414,I cacciatori di tesori - L'isola maledetta,Yun nan chong gu,2018,2018-12-29,"Action, Adventure, Fantasy",110,China,Mandarin,Xing Fei,,Golden Harvest Company,"Hang Cai, Xuan Gu, Heng Yu, Taishen Cheng, Yuke Ma, Yusi Chen, Chih-Wei Tang, Tsung-Hua To, Lu Xu","Following in the footsteps of blockbuster MOJIN: THE LOST LEGEND and based on the bestselling novel series, MOJIN: THE WORM VALLEY once again finds legendary tomb explorer Hu Bayi on a ...",4.7,312,,$ 101516,$ 22381583,,6.0,9.0
tt9493708,Underdog,Underdog,2019,2019-01-11,"Action, Drama, Sport",116,Poland,Polish,Maciej Kawulski,Mariusz Kuczewski,Ekipa,"Eryk Lubos, Mamed Khalidov, Aleksandra Poplawska, Emma Giegzno, Janusz Chabior, Tomasz Wlosok, Jaroslaw Boberek, Krzysztof Kiersznowski, Zbigniew Paterak, Mariusz Drezek, Michal Mikolajczak, Dmitrii Smoliakov, Rafal Iwaniuk, Roman Szymanski, Jedrzej Taranek",,5.7,316,,,,,1.0,1.0
tt9495690,Pagalpanti,Pagalpanti,2019,2019-11-22,"Action, Comedy",149,India,Hindi,Anees Bazmee,"Anees Bazmee, Shreya Dev Verma",Panorama Studios,"Anil Kapoor, John Abraham, Ileana D'Cruz, Arshad Warsi, Pulkit Samrat, Urvashi Rautela, Kriti Kharbanda, Saurabh Shukla, Inaamulhaq, Zakir Hussain, Brijendra Kala, Ashok Samarth, Dolly Bindra, Yash Agnihotri, Alister Albert","3 men, considered as losers in their lives by the people, plan to get rich along with their girlfriends by fooling 2 gangsters and robbing their money.",3.1,1822,,$ 423340,$ 5633633,,58.0,9.0
tt9496212,22 Yards,22 Yards,2019,2019-03-15,Sport,126,India,Hindi,Mitali Ghoshal,"Samrat, Nishant Shandilya",MS Productions 74,"Barun Sobti, Amartya Ray, Rajit Kapur, Panchi Bora, Rajesh Sharma, Chaiti Ghosal, Geetika Tyagi, Mrinal Mukherjee, Kalyan Chatterjee, Pallavi Chatterjee, Vikram Kochhar, Kartikey Tripathi, Navjot Singh, Subrata Guha Roy, Surya Kar",A dramatic portrayal of a victorious tale of a fallen cricket agent and a young cricketer.,6.2,365,,,$ 20497,,13.0,
tt9496406,Feng yu zhou,Feng yu zhou,2018,2018-08-03,Animation,105,China,Mandarin,Kuo Liu,"Yicheng Shu, Ao Yu",,,"A young man who lives in Xiaoyanggang dreams of martyrdom, but he is blind and can only sneak into the market by swindling. One day, Rakshasa attacked Xiaoyanggang, and his mother, who was ...",7.1,142,,,$ 16558135,,,
tt9497146,Mobile Suit Gundam Narrative,Mobile Suit Gundam Narrative,2018,2018-11-30,"Animation, Action, Sci-Fi",88,Japan,Japanese,Shun'ichi Yoshizawa,"Harutoshi Fukui, Harutoshi Fukui",Sunrise,"J. David Brimmer, Daniel J. Edwards, Wayne Grayson, Paul Guyet, Erika Ishii, Brianna Knickerbocker, Stefan Martello, Faye Mata, Griffin Puatu, Phillip Reich, Zeno Robinson, Melissa Schoenberg, Patrick Seitz, Robby Sharpe, Stephanie Sheh","One year has passed since the events of Mobile Suit Gundam Unicorn and the Laplace's Box was opened. Following the conflict called the ""Laplace Incident"", the Neo Zeon remnant force known ...",6.0,220,,$ 259224,$ 6126259,,4.0,
tt9500372,Cep Herkülü: Naim Süleymanoglu,Cep Herkülü: Naim Süleymanoglu,2019,2019-11-22,"Biography, Drama, Sport",141,Turkey,"Turkish, English, Bulgarian",Ozer Feyzioglu,"Ozer Feyzioglu, Baris Pirhasan",Dijital Sanatlar Production,"Hayat Van Eck, Selen Öztürk, Yetkin Dikinciler, Gürkan Uygun, Renan Bilek, Levent Ülgen, Bülent Alkis, Kemal Basar, Baris Kiralioglu, Ugur Günes, Ismail Hacioglu, Ognyan Simeonov, Murat Kiliç, Mustafa Kirantepe, Bahtiyar Engin","The biography of Turkish weight lifter, and champion of Olympics, Naim Suleymanoglu.",8.5,5682,,,$ 4920899,,42.0,4.0
tt9501310,Meitantei Conan: Konjo no fisuto,Meitantei Conan: Konjo no fisuto,2019,2019-04-12,"Animation, Action, Adventure",109,Japan,"Japanese, English",Tomoka Nagaoka,Takahiro Ohkura,Shogakukan,"Minami Takayama, Wakana Yamazaki, Megumi Hayashibara, Rikiya Koyama, Yukiko Iwai, Naoko Matsui, Ken'ichi Ogata, Wataru Takagi, Ikue Ôtani, Yu Asakawa, Kurt Common, Ryan Drees, Charles Glover, Joe Hernandez, Nobuyuki Hiyama","The world's greatest blue sapphire, the ""blue lapis fist"", said to have sunk in a pirate ship in the late 19th century, on the coasts of Singapore. A local millionaire plots to retrieve it,...",6.3,994,,,$ 115570314,,8.0,7.0
tt9506474,The Hater,Sala samobójców. Hejter,2020,2020-07-29,"Drama, Thriller",135,Poland,"Polish, English",Jan Komasa,Mateusz Pacewicz,Naima Film,"Maciej Musialowski, Vanessa Aleksander, Danuta Stenka, Jacek Koman, Agata Kulesza, Maciej Stuhr, Adam Gradowski, Piotr Biedron, Jedrzej Wielecki, Jan Hrynkiewicz, Martynika Kosnica, Wiktoria Filus, Iga Krefft, Viet Anh Do, Sebastian Szalaj",A young man searches for purpose in a net of hatred and violence that he tries to control.,7.1,6349,,,$ 1325591,61.0,62.0,33.0
tt9507234,Digimon Adventure: Last Evolution Kizuna,Digimon Adventure: Last Evolution Kizuna,2020,2020-02-21,"Animation, Action, Adventure",65,Japan,Japanese,Tomohisa Taguchi,"Akiyoshi Hongo, Akatsuki Yamatoya",Toei Animation,"Ayaka Asai, Johnny Yong Bosch, Griffin Burns, Robbie Daymond, Mari Devon, Junya Enoki, Tom Fahn, Anna Garduno, Natsuki Hanae, Erika Harlacher, Kyle Hebert, Kate Higgins, Yoshimasa Hosoya, Mao Ichimichi, Junya Ikeda","The team discovers that when they grow up, their relationship with their Digimon will come closer to an end. They realize that the more they fight, the faster their bond breaks and the time to choose is approaching fast.",7.5,347,,,$ 3966107,,3.0,1.0
tt9507276,Saga of Tanya the Evil Movie,Saga of Tanya the Evil Movie,2019,2019-02-08,"Animation, Action, Adventure",115,Japan,Japanese,Yutaka Uemura,"Carlo Zen, Kenta Ihara",Studio NuT,"Tesshô Genda, Daiki Hamano, Takaya Hashi, Saori Hayami, Daichi Hayashi, Jun Kasama, Yûsuke Kobayashi, Ryokan Koyanagi, Shin'ichirô Miki, Binbin Takaoka, Nobuo Tobita, Haruka Tomatsu, Aoi Yûki, Hôchû Ôtsuka","Tanya Degurechaff continues her misadventures, avoiding death and being sent to hell, while battling the forces of the Republic Army.",7.6,589,,$ 288460,$ 288460,,10.0,3.0
tt9509866,The Guy Who Didn't Like Musicals,The Guy Who Didn't Like Musicals,2018,2018-12-23,"Comedy, Musical",112,USA,English,Nick Lang,"Matt Lang, Nick Lang",StarKid Productions,"Jon Matteson, Lauren Lopez, Joey Richter, Jaime Lyn Beatty, Corey Dorris, Robert Manion, Mariah Rose Faith, Jeff Blim","Paul is an average guy. He likes movies, and pizza, and average guy things. He does not like - musicals. But Paul's small world is about to come crashing down under the weight of ...",8.7,330,$ 130000,,,,4.0,
tt9511256,Preman Pensiun,Preman Pensiun,2019,2019-01-17,"Comedy, Crime, Drama",94,Indonesia,Indonesian,Aris Nugraha,Aris Nugraha,MNC Pictures,"Epy Kusnandar, Tia Arifin, Soraya Rasyid, Dedi Moch Jamasari, Andra Manihot, Deny Firdaus, Ica Naga, Abenk Marco, M. Fajar Hidayatullah, Purwo Kristiono, Mang Uu, Sadana Agung Sulistya, Sandi Tile, Nining Yuningsih, Vina Ferina","After three years, the business of Muslihat, who has retired as a thug, has a problem. He also faces new problems when her daughter grows up and visited by the boys. The friction between his former subordinates also starts to happen again.",7.0,117,,,,,2.0,4.0
tt9514970,Danmarks sønner,Danmarks sønner,2019,2019-04-11,"Drama, Thriller",123,Denmark,"Danish, Arabic",Ulaa Salim,Ulaa Salim,Hyæne Film,"Zaki Youssef, Mohammed Ismail Mohammed, Imad Abul-Foul, Rasmus Bjerg, Ari Alexander, Ivan Alan Ali, Lars Bendix, Asil Mohamad Habib, Morten Holst, Elliott Crosset Hove, Ali Hussein, Olaf Johannessen, Özlem Saglanmak","Denmark four years into the future. After a major bomb attack in Copenhagen radicalization and ethnic tensions are running high, and a racist leader is leading the polls.19-year old Zakaria is afraid, wanting to do something.",6.4,1341,,,$ 13219,,9.0,25.0
tt9515298,Pandamonium,Pandamonium,2020,2020-03-02,"Comedy, Horror",86,UK,English,Mj Dixon,Mj Dixon,H B Films,"David Hon Ma Chu, Oriana Charles, Dani Thompson, Will Jones, James Hamer-Morton, Lee Mark Jones, Charlie Bond, William Marshall, Chloe Badham, Derek Nelson, Tatiana Ibba, Annie Knox, Martin W. Payne, Pablo Raybould, Charlie Clarke",Arielle's first day at work spirals into Pandemonium as a serial killer locks his sights on the after office party.,3.1,352,,,,,16.0,7.0
tt9515732,Xane: The Vampire God,Xane: The Vampire God,2020,2020-02-01,"Adventure, Drama, Fantasy",118,USA,English,Johnny Pendragon,"Kara Farden, Johnny Pendragon",Hot Coffee Films,"Parker Boles, Jenna Farden, Robere Kazadi, Zoë Kelly, Brennen Davis, Michelle Oneida, Dylan Wood, Jon A. Ravenholt, Scott Grady, Jen Potcher, Kitty Suzanne Sigler, William H. Parker Jr., MaKenna Conley, Joy Graham, Leslie Lelo Lopez","Xane, an immortal vampire, returns to the past to save his former self, Titus. Xane must rescue Titus and stop him from inheriting the curse. Xane is able to save his loved ones, but the broad strokes of time cannot be altered.",5.0,225,,,,,3.0,1.0
tt9519642,Hasta que la boda nos separe,Hasta que la boda nos separe,2020,2020-02-14,"Comedy, Romance",110,Spain,Spanish,Dani de la Orden,"Eric Navarro, Olatz Arroyo",Atresmedia Cine,"Belén Cuesta, Álex García, Silvia Alonso, Antonio Dechent, Mariam Hernández, Gracia Olayo, Salva Reina, Ricardo Castella, Jorge Ponce, Ernesto Sevilla, Adrián Lastra, Leo Harlem, Malena Alterio, Antonio Resines, Jordi Sánchez",A love affair to hide. A wedding to prepare. A disaster to come.,5.8,580,,,$ 3037094,,2.0,7.0
tt9520140,Güzelligin Portresi,Güzelligin Portresi,2019,2019-12-13,"Drama, Horror, Thriller",127,Turkey,Turkish,Umur Turagay,"Pinar Bulut, Onur Koralp",BKM Film,"Burçin Terzioglu, Birkan Sokullu, Melisa Senolsun, Serkan Keskin, Feridun Düzagaç, Gizem Erman Soysaldi, Lara Tonka","Receiving important news about her father, whom she has not met for years, Nisan returns to her father's house with her husband and daughter. There are strange things happening in this ...",6.4,1937,,,$ 329612,,19.0,2.0
