imdb_title_id,title,original_title,year,date_published,genre,duration,country,language,director,writer,production_company,actors,description,avg_vote,votes,budget,usa_gross_income,worlwide_gross_income,metascore,reviews_from_users,reviews_from_critics
tt9750864,Ghasr-e Shirin,Ghasr-e Shirin,2019,2019-07-24,Drama,82,Iran,"Persian, Turkish",Reza Mirkarimi,"Mohammad Davoudi, Mohsen Gharaie",Irimage,"Hamed Behdad, Zhila Shahi, Azadeh Nobahari, Niousha Alipour, Yuna Tadayyon, Akbar Aein, Mohammad Ashkanfar, Zoheyr Yari, Mohammad Asgari, Babak Lotfi Khajepasha, Saleh Karami","When the mother of a separated family dies, Jalal the father returns to sort things out but he does not want to take the children with him.",6.6,705,,,,,4.0,50.0
tt9752544,Hikkoshi daimyô!,Hikkoshi daimyô!,2019,2019-08-30,"Comedy, History",120,Japan,Japanese,Isshin Inudô,Akihiro Dobashi,Shochiku,"Gaku Hamada, Gen Hoshino, Yutaka Matsushige, Masahiko Nishimura, Mitsuhiro Oikawa, Midori Oka, Yukiyoshi Ozawa, Issey Takahashi, Mitsuki Takahata",The noble Katagiri Harunosuke is both a warrior and a scholar. He is a samurai in the employment of his lord or Daimyo and also a bookworm. His newest and somewhat surprising task is to ...,6.2,124,,,$ 6246509,,1.0,3.0
tt9755608,23 Nafar,23 Nafar,2019,2019-12-11,"Drama, War",101,Iran,"Persian, Arabic, English",Mehdi Jafari,Mehdi Jafari,Owj Arts and Media Organization,"Saeed Alboebadi, Reza Noori, Majid Potki, Abdolhalim Taghalobi, Hamzeh Vatani, Mohammad Ali Mousavi",The story of 23 young Iranian warriors who were captivated by Iraqi army.,6.6,148,,,,,,1.0
tt9755660,Maskhare Baz,Maskhare Baz,2019,2019-10-09,"Comedy, Crime, Fantasy",100,Iran,Persian,Amir Homayoun Ghanizadeh,Amir Homayoun Ghanizadeh,,"Ali Nassirian, Saber Abar, Babak Hamidian, Reza Kianian, Hediyeh Tehrani, Darioush Movaffagh, Mohsen Hosseini, Iman Fattahi, Amir Ahmadzadeh",Danesh works in a barbershop and dreams about becoming an actor. Manfered is an agent who would introduce Danesh to a famous director if he collects enough long hairs to be used as wigs. At...,6.5,541,,,,,8.0,2.0
tt9759978,The Dude in Me,The Dude in Me,2019,2019-01-09,"Comedy, Fantasy",122,South Korea,Korean,Hyo-jin Kang,,,"Sung-woong Park, Jinyoung Jung, Mi-ran Ra, Soo-min Lee, Joon-hyuk Lee, Kwang-gyu Kim, Kim Hyeon-mok, Park Joo-Hyun, Bu-seon Kim, Hong-pa Kim, Hyuk-Bum Kwon, Poong Woon Lee, Ji-ah Min, Kyung-hye Park, Kwang-eop Son",A weak high school student and a mighty gangster exchange their bodies accidentally.,6.9,924,,,$ 14569310,,12.0,8.0
tt9760504,Ni no Kuni,Ni no Kuni,2019,2019-08-23,"Animation, Action, Adventure",106,Japan,"Japanese, English",Yoshiyuki Momose,"Akihiro Hino, Akihiro Hino",Eiga Ni no Kuni Seisaku Iinkai,"Kento Yamazaki, Tucker Chandler, Ray Chase, Greg Chun, Robbie Daymond, John DeMita, David Errigo Jr., Tom Fahn, Dorah Fine, Brian Hanford, Erika Harlacher, Kyle Hebert, Janice Kawaye, Wendee Lee, Erica Lindbeck","High schooler Yuu and his friend Haru get involved in a case involving his childhood friend Kotona, which forces them to go back and forth between another world that is different but is ...",6.1,2250,,,$ 2858846,,41.0,7.0
tt9760512,D/O Parvathamma,D/O Parvathamma,2019,2019-05-24,Action,110,India,Kannada,Shankar,,Disha Entertainments,"Abhishek, Swetha Bharadwaj, Manjunath Bhatt, Devayya, Devendra, Raj Gopal, Shilpa Gowda, Suraj Gowda, Haripriya, Girish Jatti, Karthik, Ananya Kashyap, Sridhar Kesari, Jayashree Krishna, Shantha Kumar","An investigative officer investigates a sensational and challenging murder case, which has many layers.",5.9,395,INR 500000,,,,16.0,1.0
tt9760934,Villain,Villain,2018,2018-10-12,Action,132,India,Bengali,,Raman K. Jangwal,SVF Entertainment,"Arrayan, Mimi Chakraborty, Arindam Dutta, Raja Dutta, Ankush Hazra, Mousumi Saha, Rittika Sen, Subhadra Zayed, Zoyeb","""Villain""narrates the story of Raja, the protagonist, whose life takes an unknown turn when he meets his lookalike Joy, that leads to a series of incidents that follow due to the exchanged identities.",5.0,117,,,,,,
tt9761042,Nobadi,Nobadi,2019,2019-10-04,Drama,89,Austria,German,Karl Markovics,Karl Markovics,Epo-Film Produktionsgesellschaft,"Heinz Trixner, Borhanulddin Hassan Zadeh, Konstanze Dutzi, Maria Fliri, Simone Fuith, Edmund Jäger, Julia Schranz, Sven Sorring","A grumpy old man enlists the help of an Afghani migrant to bury his dead dog, and as the two dredge through prejudices to find common ground, their day takes an unexpected turn.",6.4,106,,,,,,15.0
tt9764556,Sadako,Sadako,2019,2019-05-24,Horror,99,Japan,Japanese,Hideo Nakata,"Noriaki Sugihara, Kôji Suzuki",Kadokawa,"Himeka Himejima, Elaiza Ikeda, Ren Kiriyama, Hiroya Shimizu, Rie Tomosaka, Takashi Tsukamoto","A group of people must find out how to stop the newborn deadly curse, which has born and gone viral after a Youtuber accidentally captured a vengeful ghost on camera.",4.1,433,,,$ 5481562,,6.0,36.0
tt9765144,Gimyohan gajok,Gimyohan gajok,2019,2019-02-13,"Comedy, Horror",112,South Korea,Korean,Lee Min-jae,,Cinezoo,"Jong-ryol Choi, Se-ah Jang, Jae-yeong Jeong, Ga-ram Jung, Nam-gil Kim, Soo-kyung Lee, Ji-won Uhm","When a pharmaceutical company's illegal experiments inadvertently create a zombie, the strange Park family finds it and tries to profit from it.",6.5,890,,,$ 1949681,,13.0,44.0
tt9766160,Damayanthi,Damayanthi,2019,2019-11-29,Drama,161,India,Kannada,Navarasan,,Sri Lakshmi Vrushadhri Productions,"Radhika Kumaraswamy, Adya, Amarnath, Anjana, Lalana R. Arya, Raj Bahadhur, Kavya Gowda, Ravi Gowda, Tanu Gowda, Karthik, Krishna Murthi Kawthar, Kempegowda, Sadhu Kokila, Honnavalli Krishna, Naveen Krishna",After several years Damayanthi returns to exact her revenge on the people who brutally murdered her entire family for getting the inheritance.,8.4,1076,INR 20000000,,,,7.0,
tt9766280,Bhangra Paa Le,Bhangra Paa Le,2020,2020-01-03,"Comedy, Drama, Music",131,India,Hindi,Sneha Taurani,Dheeraj Rattan,RSVP,"Sunny Kaushal, Rukshar Dhillon, Shriya Pilgaonkar, Parmeet Sethi, Samir Soni, Chaitnya Sharma, Sheeba Chaddha, Jayati Bhatia, Akarsh Khurana, Kamlesh Gill, Sarthak Kakar, Swasti Kapur, Mark Bennington, Asha Arora, Radhika Bangia","Determined to bring traditional bhangra to the world stage, a dancer preps for an international competition against a rival with dreams of her own.",6.1,221,,,$ 1177,,21.0,3.0
tt9766310,Kanpuriye,Kanpuriye,2019,2019-10-25,Drama,103,India,Hindi,Ashish Aryan,Ashish Aryan,Saregama India,"Aparshakti Khurana, Divyendu Sharma, Vijay Raaz, Rajshri Deshpande, Harshita Gaur, Harsh Mayar, Bhupesh Pandya, Vani Sood, Chittaranjan Tripathy, Bhupesh Bandekar, Rohit Chaudhary, Arun Kalra, Ankita Maity, Ravish Srivastava","The story revolves around the story of three boys from the small town of Kanpur, who have big dreams, and even bigger challenges.",6.3,865,,,,,329.0,
tt9767556,Un sogno per papà,Fourmi,2019,2019-12-05,Drama,105,"France, Belgium","French, English",Julien Rappeneau,"Artur Laperla, Julien Rappeneau",The Film,"François Damiens, Maleaume Paquin, André Dussollier, Ludivine Sagnier, Laetitia Dosch, Sébastien Chassagne, Didier Brice, Cassiopée Mayance, Pierre Gommé, Ismaël Dramé, Nicolas Wanczycki, Pierre Diot, Jonathan Waite, Laurent Orry, Martine Schambacher","Théo would like to give some hope to his father, Laurent, a lonely alcoholic and disillusioned with life. The opportunity comes when Théo is about to be signed by Arsenal FC.",6.2,152,,,$ 856117,,,8.0
tt9769714,Jada,Jada,2019,2019-12-06,"Drama, Sport",132,India,Tamil,Kumaran,,The Poet Studios,"Kathir, Roshini, Yogi Babu, Kishore Kumar G., Prajuna Sarah, Swathishta",A team of passionate football players goes through some unexpected hurdles while participating in a local tournament in a village.,5.6,111,,,$ 3542,,3.0,3.0
tt9773184,Mareld,Mareld,2019,2019-11-15,Thriller,94,Sweden,Swedish,Ove Valeskog,,Tribespider Film,"Hanna Oldenburg, Viktor Åkerblom, Moa Malan, Matti Boustedt, Malin Barr, Linnea Pihl, Angry Man Across the Water, Jonatan Bjerke, Zacharias Boustedt, Fredrik Ejemo, Daniel Epstein, Thomas Goder, Olof Jonsson, Alex Kalmér, Bernhard Lebourne","A film team sets off on a catamaran to make a thriller. They come across surprises and in the end you can't distinguish between reality and fiction. In the film, we follow the fictional and documentary events in parallel.",4.8,177,,,,,8.0,6.0
tt9773532,Siempre sí,Siempre Sí,2019,2020-06-26,Drama,104,"Chile, Mexico",Spanish,Alberto Fuguet,Alberto Fuguet,Cinepata,"Gerardo Torres Rodríguez, Pavel Akindog, Anty de la Vega, Lalo Santos, Irvin Morlag, Franco Ruiz, Andrés Sánchez, Effy Oropeza, Christo Cansio","Héctor travels from Hermosillo to Mexico City with the hope of posing naked for photography collective Feral. His friend Carlos chose not to go with him, and Héctor, determined to ...",6.3,285,$ 20000,,,,,2.0
tt9777644,Da 5 Bloods - Come fratelli,Da 5 Bloods,2020,2020-06-12,"Adventure, Drama, War",154,USA,"English, Finnish, French, Vietnamese",Spike Lee,"Danny Bilson, Paul De Meo",40 Acres & A Mule Filmworks,"Delroy Lindo, Jonathan Majors, Clarke Peters, Norm Lewis, Isiah Whitlock Jr., Mélanie Thierry, Paul Walter Hauser, Jasper Pääkkönen, Johnny Nguyen, Y. Lan, Lam Nguyen, Sandy Huong Pham, Jean Reno, Chadwick Boseman, Veronica Ngo",Four African American vets battle the forces of man and nature when they return to Vietnam seeking the remains of their fallen squad leader and the gold fortune he helped them hide.,6.5,29694,,,,82.0,673.0,217.0
tt9777790,C'est quoi cette mamie?!,C'est quoi cette mamie?!,2019,2019-08-07,Comedy,99,"France, Belgium","French, English, Spanish",Gabriel Julien-Laferrière,"Gabriel Julien-Laferrière, Sébastien Mounier",Bonne Pioche,"Chantal Ladesou, Julie Gayet, Thierry Neuvic, Julie Depardieu, Lucien Jean-Baptiste, Claudia Tagbo, Philippe Katerine, Arié Elmaleh, Nino Kirtadze, Sadio Diallo, Violette Guillon, Teïlo Azaïs, Luna Aglat, Benjamin Douba-Paris, Chann Aglat",A mamie is having a good vacances with her small children.,4.5,256,,,$ 9488949,,1.0,1.0
tt9778190,Shinbun kisha,Shinbun kisha,2019,2019-06-28,Drama,113,Japan,"Japanese, English",Michihito Fujii,Isoko Mochizuki,Star Sands,"Eun-kyung Shim, Tôri Matsuzaka, Tsubasa Honda, Amane Okayama, Tomohiro Kaku, Seiya Osada, Hina Miyano, Tsutomu Takahashi, Naomi Nishida, Kazuya Takahashi, Yukiya Kitamura, Tetsuji Tanaka, Ian Moore","It is the job of the press to cover corporate crime, government plots and society. It is in this context that young female reporter on the beat Erika rolls up her sleeves and goes to work ...",6.3,301,,,$ 3836428,,2.0,9.0
tt9778738,A Girl Missing,Yokogao,2019,2019-07-26,Drama,111,"Japan, France",Japanese,Kôji Fukada,"Kôji Fukada, Kazumasa Yonemitsu",Kadokawa,"Mariko Tsutsui, Mikako Ichikawa, Sôsuke Ikematsu, Kentez Asaka, Mitsuru Fukikoshi, Nahoko Kawasumi, Miyu Ozawa, Ren Sudo, Hisako Ôkata",A home-care nurse's relationship with the family she has spent years working for is threatened when her nephew is arrested for kidnapping their daughter.,6.3,395,,,,52.0,1.0,22.0
tt9778888,Il sindaco del Rione Sanità,Il sindaco del Rione Sanità,2019,2019-09-30,"Crime, Drama",115,Italy,Italian,Mario Martone,"Eduardo De Filippo, Mario Martone",Indigo Film,"Francesco Di Leva, Adriano Pantaleo, Roberto De Francesco, Massimiliano Gallo, Daniela Ioia, Giuseppe M. Gaudino, Gennaro Di Colandrea, Lucienne Perreca, Salvatore Presutto, Viviana Cangiano, Domenico Esposito, Ralph P., Armando De Giulio, Daniele Baselice, Morena Di Leva","This particular version of Naples is home to Antonio Barracano, the young, vigorous and tattooed Mayor of Rione Sanità who plays by his own rules; a paternal figure who oversees the licit and illicit activities unfolding within the city.",5.1,450,,,$ 465257,,3.0,16.0
tt9779516,Cosa mi lasci di te,I Still Believe,2020,2020-03-19,"Biography, Drama, Music",116,USA,English,"Andrew Erwin, Jon Erwin","Jeremy Camp, Jon Erwin",Kevin Downes Productions,"K.J. Apa, Britt Robertson, Nathan Parsons, Gary Sinise, Shania Twain, Reuben Dodd, Nicolas Bechtel, Melissa Roxburgh, Terry Serpico, Tanya Christiansen, Cameron Arnett, Abigail Cowen, Rushi Birudala, Anjelah Johnson-Reyes, Mike McGill",The true-life story of Christian music star Jeremy Camp and his journey of love and loss that looks to prove there is always hope.,6.5,6196,$ 12000000,$ 9868521,$ 13681524,41.0,151.0,52.0
tt9779658,Mestari Cheng,Mestari Cheng,2019,2019-09-27,"Comedy, Drama",114,"Finland, China","English, Finnish, Mandarin",Mika Kaurismäki,Hannu Oravisto,By Media,"Pak Hon Chu, Lucas Hsuan, Vesa-Matti Loiri, Anna-Maija Tuokko, Kari Väänänen","Following the death of his wife, professional chef CHENG travels with his young son to a remote village in Finland to connect with an old Finnish friend he once met in Shanghai. Upon ...",6.8,251,EUR 2869000,,$ 435909,,4.0,14.0
tt9779804,15 Years,15 Years,2019,2020-02-27,Drama,89,Israel,Hebrew,Yuval Hadadi,Yuval Hadadi,Anemos Productions,"Oded Leopold, Udi Persi, Ruti Asarsai, Dan Mor, Tamir Ginsburg, Lirit Balaban, Ofek Aharony, Or Asher, Keren Tzur","Yoav's demons start haunting him after his best friend becomes pregnant without telling him, and after his boyfriend of 15 years starts talking about children too. His life unravels, and self-destruction seems inevitable.",7.4,258,,,,,5.0,14.0
tt9780140,Qissat Hubb,Qissat Hubb,2019,2019-02-14,"Comedy, Romance",110,"Egypt, United Arab Emirates","Arabic, English",Othman Abo Labn,"Amani El-Tunsi, Yasser Salah",,"Ahmed Hatem, Hana El Zahed, Yasser El Tobgy, Mina Fawzy, Miral Mahilian, Ahmed Saad Misho, Moamen Noor, Ola Roshdy, Feras Said, Hanan Soliman, Farah Youssef",The movie is about a love story between a young man and a girl that goes under a difficult test when her lover become blind and they must proof to each other their love.,7.3,346,,,$ 44755,,10.0,
tt9782756,Apollo: Missions to the Moon,Apollo: Missions to the Moon,2019,2019-07-07,History,94,USA,English,Tom Jennings,Tom Jennings,1895 Films,"Buzz Aldrin, Bill Anders, Neil Armstrong, Frank Borman, Walter Cronkite, Betty Grissom, Jim Lovell","In the late 1960s, the United States space program neared its goal of landing a man on the Moon, but it was a journey that began years before. This is the story of Project Apollo - 12 years...",7.7,229,,,,,1.0,1.0
tt9783778,Adventures of Aladdin,Adventures of Aladdin,2019,2019-05-13,"Adventure, Family, Fantasy",87,USA,English,Glenn Campbell,"Glenn Campbell, Tammy Klein",The Asylum,"Adam Hollick, Daniel O'Reilly, Lucia Dimitra Xypteras, Monroe Robertson, Naya Mousa, Havon Baraka, Manny Zaldivar, Lord KraVen, Joe Roche, Sharieff Walters, Americus Abesamis, Mark Sawicki, Mark Pirro, Michael Gaglio, Tammy Klein","With the help of a magical lamp, an impoverished young man transforms himself into a prince in order to win the heart of a beautiful princess.",1.8,1097,,,,,61.0,2.0
tt9784048,Jandar,Jandar,2019,2019-12-11,Drama,100,Iran,Persian,"Hosein Amiri Doumari, Pedram Amiri","Hosein Amiri Doumari, Pedram Amiri",,"Fatemah Motamed-Aria, Hamed Behdad, Javad Ezati, Baran Kosari, Masoud Karamati, Mohammad Ali Mohammadi, Ali Shadman, Gity Ghasemi, Amir Ahmad Ghazvini, Mojtaba Fallahi, Alireza Mehran, Mohammad Sadegh Malek, Mojtaba Katuzian, Ehsan Rahimdel, Morteza Khanjani","Asma's previous suitor Yaser ruins her wedding Ceremony. Her brother Jamal accidentally kills Yaser's brother. Yaser's odd suggestion in order to forgive Jamal, endangers Asma's Marriage.",6.2,342,,,,,6.0,1.0
tt9784456,The Kissing Booth 2,The Kissing Booth 2,2020,2020-07-24,"Comedy, Romance",134,"UK, USA",English,Vince Marcello,"Vince Marcello, Jay S Arnold",Komixx Entertainment,"Joey King, Joel Courtney, Jacob Elordi, Molly Ringwald, Taylor Zakhar Perez, Maisie Richardson-Sellers, Meganne Young, Stephen Jennings, Carson White, Bianca Bosch, Camilla Wolfson, Zandile-Izandi Madliwa, Judd Krok, Sanda Shandu, Hilton Pelser","In the sequel to 2018's THE KISSING BOOTH, high school senior Elle juggles a long-distance relationship with her dreamy boyfriend Noah, college applications, and a new friendship with a handsome classmate that could change everything.",5.9,15189,,,,39.0,340.0,46.0
tt9786512,Adiós,Adiós,2019,2019-11-22,"Action, Drama, Thriller",111,Spain,Spanish,Paco Cabezas,"José Rodríguez, Carmen Jimenez",Adiós la Película,"Mario Casas, Natalia de Molina, Ruth Díaz, Carlos Bardem, Vicente Romero, Paulina Fenoy, Mauricio Morales, Sebastián Haro, Mona Martínez, Pilar Gómez, Pablo Gómez-Pando, Consuelo Trujillo, Mariola Fuentes, Juan Carlos Villanueva, Carlos Cabra",A con man with freedom supervised starts a bloody path of revenge when his little daughter dies in a car crash after of First Communion's celebration.,6.1,853,,,$ 2232821,,3.0,10.0
tt9789440,Ninu Veedani Needanu Nene,Ninu Veedani Needanu Nene,2019,2019-07-12,Comedy,123,India,Telugu,Caarthick Raju,Caarthick Raju,V Studios,"Ajay., Vi Anand, Ashiq., Daya, Kayal Devaraj, Dheena, Divya Ganesh, Michael George, Poornima Jayaram, Ravi Kamal, Karunakaran, Sundeep Kishan, Vennela Kishore, Kumaravel, Malavika Nair",Ninu Veedani Needanu Nene is about a young man who gets mired in a dire situation and comes out successfully.,5.9,309,,,,,7.0,
tt9789670,Porinju Mariam Jose,Porinju Mariam Jose,2019,2019-08-23,"Action, Comedy, Drama",148,India,Malayalam,Joshiy,"Abhilash N. Chandran, Abhilash N. Chandran",David Kachappilly Productions,"Joju George, Chemban Vinod Jose, Nyla Usha, Vijayaraghavan, Rahul Madhav, T.G. Ravi, Salim Kumar, Nandu, Swasika Vijay, Sudhi Koppa, Sarasa Balussery, Anil Nedumangad, Disney James, Amal Shah, Govind V. Pai","Set against the backdrop of a church festival in Thrissur, is a story of friendship, love and revenge that revolves around the lives of a rowdy, an aristocratic and their mutual friend.",6.8,877,,,$ 544889,,22.0,2.0
tt9789686,Un rubio,Un rubio,2019,2019-08-29,"Drama, Romance",108,Argentina,Spanish,Marco Berger,Marco Berger,Universidad del Cine,"Gaston Re, Alfonso Barón, Malena Irusta, Ailín Salas, Charly Velasco, Justo Calabria, Franco Heiler, Antonia De Michelis, Melissa Falter","In the suburbs of Buenos Aires, Gabriel has just moved in with his colleague, Juan. Shy and reserved, Gabo is reluctant to follow Juan's wandering hands and meaningful looks.",7.4,1642,,,$ 3983,,27.0,15.0
tt9793334,Athiran,Athiran,2019,2019-04-12,"Mystery, Thriller",135,India,Malayalam,Vivek,"P.F. Mathews, Ajai Rahul",Century Investments,"Fahadh Faasil, Sai Pallavi, Atul Kulkarni, Lena, Renji Panicker, Sudev Nair, Shantikrishna, P. Balachandran, Baiju V.K., Surabhi Lakshmi, Jayaprakash Kuloor, Leona Lishoy, Vijay Menon, Nandu, Prakash Raj","In an isolated hospital in the high ranges of Kerala, an autistic patient with special skills piques the interest of a psychiatrist, whose investigation into her past leads to startling revelations.",6.8,1280,,,,,33.0,3.0
tt9794630,The Vanished,Hour of Lead,2020,2020-08-21,"Action, Mystery, Thriller",95,USA,English,Peter Facinelli,Peter Facinelli,Adonais Productions,"Anne Heche, Thomas Jane, Jason Patric, Alex Haydon, Peter Facinelli, Aleksei Archer, Kristopher Wente, John D. Hickman, Mitchell L. Johnson, Kk Heim, Sadie Heim, Rebecca Lines, Lily Anne Harrison, Curtis Nichouls, Lucas Bentley","Story of a husband and wife that will stop at nothing to find her missing daughter, who disappeared on a family camping trip. When the police don't catch any leads, the duo take over.",5.6,810,,,,,57.0,9.0
tt9795368,Tobol,Tobol,2019,2019-02-21,"Action, Drama, History",108,Russia,Russian,Igor Zaytsev,"Aleksei Ivanov, Aleksey Permyakov",Solivs,"Andrey Burkovskiy, Erkebulan Dairov, Evgeniy Dyatlov, Dmitriy Dyuzhev, Aleksandr Lazarev, Yuliya Makarova, Ilya Malanin, Agata Mutsenietse, Dmitriy Nazarov, Philippe Reinhardt, Pavel Tabakov","A young officer, Ivan Demarin, is sent to the depths of Siberia. Here Ivan meets his first love and, together with his regiment, finds himself drawn into a conspiracy by local princes, who are hunting for Yarkand's gold.",5.8,770,,,$ 1979998,,3.0,
tt9799984,Falaknuma Das,Falaknuma Das,2019,2019-05-31,"Action, Thriller",145,India,Telugu,Vishwak Sen,Chemban Vinod Jose,Vanmaye Creations,"Aakash, Ajay, Sunjit Akkinepalli, Master Aman, Aravind, Azhar, Upendra Barman, Basha, Avinash Baswapuram, Bunny, Anmona Chaliha, Chandu, Suri k Chaplin, Prashanthi Charuolingah, Vivek Chepuri","Set in the backdrop of the colonies of falaknuma where a group of youngsters fall into unexpected consequences which lead them to a driving pathway of violence, brutality and ruthlessness.",6.3,543,,,,,18.0,3.0
tt9799992,Sang Krasue,Sang Krasue,2019,2019-03-14,"Drama, Horror, Romance",122,Thailand,Thai,Sitisiri Mongkolsiri,"Sitisiri Mongkolsiri, Chookiat Sakveerakul",Nakid,"Phantira Pipityakorn, Oabnithi Wiwattanawarang, Sapol Assawamunkong, Surasak Wongthai, Sahatchai 'Stop' Chumrum, Sahajak Boonthanakit, Makara Supinacharoen, Sasithorn Panichnok, Darina Boonchu, Namngen Boonnark, Phakwan Chaowalit, Pankorn Chantasorn, Ittipat Lekuthaiwan, Punnarat Lasutthi, Makhasiri Thepsittha","In a far-away village, lived an innocent teenage girl, ""Sai"" who later discovered herself inheriting the curse of ""Krasue"". At night, her head would detach from her body and hunts for flesh...",6.5,1206,$ 1200000,,$ 171229,,14.0,23.0
tt9801736,"Hvítur, hvítur dagur","Hvítur, hvítur dagur",2019,2019-09-06,Drama,109,"Iceland, Denmark, Sweden",Icelandic,Hlynur Palmason,Hlynur Palmason,Danish Film Institute,"Ingvar Sigurdsson, Ída Mekkín Hlynsdóttir, Hilmir Snær Guðnason, Sara Dögg Ásgeirsdóttir, Björn Ingi Hilmarsson, Elma Stefania Agustsdottir, Haraldur Stefansson, Laufey Elíasdóttir, Sigurður Sigurjónsson, Arnmundur Ernst Björnsson, Þór Tulinius, Sverrir Þór Sverrisson, Ari Birgir Ágústsson, Jóhann Kristófer Stefánsson, Þorgils Hlynsson",An off duty police begins to suspect a local man for having had an affair with his recently dead wife. Gradually his obsession for finding out the truth accumulates and inevitably begins to endanger himself and his loved ones.,6.9,2207,,,$ 615217,80.0,12.0,82.0
tt9805110,Sangkar,Sangkar,2019,2019-08-29,"Drama, Sport",112,Malaysia,Malay,Kabir Bhatia,Mira Mustaffa,Astro Shaw,"Zul Ariffin, Remy Ishak, Mira Filzah, Nik Adam Mika, Zarul Albakri, Carliff Carleel, Peter Davis, Aman Graseka, Fadlan Hazim, James McSweeney, Emelda Rosmila, Rashid Salleh, Niezam Zaidi","The road to redemption of a fighter, who seeks forgiveness from the very man he destroyed.",6.9,121,MYR 3000000,,,,9.0,2.0
tt9805504,Otryv,Otryv,2019,2019-02-14,Thriller,85,Russia,"Russian, English",Tigran Sahakyan,"Denis Kosyakov, Alexandr Nazarov",Attraction Film Company,"Irina Antonenko, Anastasiya Grachyova, Vladimir Gusev, Denis Kosyakov, Andrey Nazimov, Aleksandr Nikitchenko, Ingrid Olerinskaya, Angelina Pikovskaya, Viktoriya Pyatakina, Kseniya Shumeyko, Sergey Todorov, Marina Vasilenko, Elena Vetrova","Five young adults, who want to celebrate New Years Eve on top of a mountain, get stuck in a gondola lift. What started out as an adventurous party, soon becomes a fight for survival.",4.4,1160,,,$ 353569,,31.0,12.0
tt9805740,Pasmerkti. Kauno Romanas,Pasmerkti. Kauno Romanas,2019,2019-02-22,"Crime, Drama, Thriller",94,Lithuania,Lithuanian,Ramunas Rudokas,Erikas Kundreckas,Singing Fish,"Ramunas Rudokas, Agne Sataite, Sarunas Datenis, Simonas Storpirstis, Tomas Kizelis, Justina Nemanyte, Robertas Lenartavicius",Based on true story of four friends who decided to take over the city. Giedrius is released after serving a long 12 year sentence for unlawful conduct he did with his friends while being a child.,6.1,282,,,$ 591008,,2.0,
tt9806192,Dov'è il mio corpo?,J'ai perdu mon corps,2019,2019-11-29,"Animation, Drama, Fantasy",81,France,French,Jérémy Clapin,"Jérémy Clapin, Guillaume Laurant",Xilam,"Hakim Faris, Victoire Du Bois, Patrick d'Assumçao, Alfonso Arfi, Hichem Mesbah, Myriam Loucif, Bellamine Abdelmalek, Maud Le Guenedal, Nicole Favart, Quentin Baillot, Céline Ronté, Deborah Grall, Pascal Rocher, Bruno Hausler, Jocelyn Veluire","A story of Naoufel, a young man who is in love with Gabrielle. In another part of town, a severed hand escapes from a dissection lab, determined to find its body again.",7.6,24010,,,$ 1136431,80.0,112.0,106.0
tt9806322,Isi & Ossi,Isi & Ossi,2020,2020-02-14,"Comedy, Romance",113,Germany,German,Oliver Kienle,Oliver Kienle,X-Filme Creative Pool,"Lisa Vicari, Darcy Rose Byrnes, Dennis Mojen, Lynnea Smith, Langston Uibel, Susan Angelo, Pegah Ferydoni, Ernst Stötzner, Christina Hecke, Lisa Hagmeister, Mostafa Elmorsy, Chris Patrickson, André Eisermann, Hans-Jochen Wagner, Bettina Hoppe","To realize their culinary and boxing dreams, the daughter of a billionaire forms a mutually beneficial alliance with the son of a struggling single mom.",6.4,5423,,,,,33.0,15.0
tt9806336,La febbre del cemento,Betonrausch,2020,2020-04-17,"Comedy, Drama",94,Germany,"German, English",Cüneyt Kaya,"Cüneyt Kaya, Cüneyt Kaya",UFA Fiction,"David Kross, Emily Goss, Frederick Lau, Janina Uhse, Enrico Lo Verso, Susan Angelo, David Haack, Dejan Bucin, Jerry Kwarteng, Uwe Preuss, Gia Bay, Sophia Thomalla, Pierre Kiwitt, Hannes Wegener, Anne Schäfer","Charting the rise and fall of three corrupt real estate agents who accumulate absurd wealth in no time but fall into a vortex of fraud, greed and drugs.",5.7,3385,,,,40.0,32.0,26.0
